AAPL,BRIEF-Apple has a secret team of biomedical engineers working on treating diabetes - CNBC,Apple hires secret team for treating diabetes- CNBC
ACN,BRIEF-Accenture completes acquisition of 62 pct shareholding in SinnerSchrader AG
ALK,"BRIEF-Alaska Airlines, Virgin America announce new Dallas Love Field flying to 5 destinations",BRIEF-Alaska Air sees Q1 passenger revenue per ASM 10.26 cents to 10.31 cents
AMZN,"BRIEF-CEO Amazon Web Services, Andrew Jassy's 2016 total compensation was $35.6 mln",Wal-Mart offers discounts for online orders picked up in store
AVGO,Broadcom makes highest first-round bid of $23 bln for Toshiba chip unit: source,Broadcom makes highest first-round bid of $23 bln for Toshiba chip unit -source,"Broadcom, Western Digital among four suitors for Toshiba chip unit - sources","Broadcom, Western Digital among four suitors for Toshiba chip unit -sources"
BAC,Judge lets Bank of America appeal decision on overdraft fees
BK,Puerto Rico COFINA bondholder sues trustee Bank of New York
CAT,BRIEF-Caterpillar maintains dividend rate,BRIEF-Former AT&T executive Ray Wilkins joins Caterpillar's board
CME,UPDATE 1-CME Group shuts loss-making London derivatives and clearing units,CME Group intends to close CME Europe and CME clearing Europe by year end,BRIEF-CME Group intends to close CME Europe and CME clearing Europe by year-end,COLUMN-No relief for the London Metal Exchange as volumes fall again: Andy Home,LME reform controversy highlights divisions between members
CTL,'Shopping cart' patent successor targets CenturyLink with lawsuit,"BRIEF-CenturyLink says Delaware, Hawaii, Maryland and District of Columbia approve company's level 3 merger"
DAL,BRIEF-Delta Air Lines reports qtrly earnings per diluted share $0.82,Delta Air profit falls 36.3 percent
DG,California sues Dollar General unit over hazardous waste disposal,BRIEF-Dollar General says CEO Vasos' total 2016 compensation was $8.6 mln
DUK,"BRIEF-Duke Energy announced Power/Forward Carolinas, $13 billion project"
FAST,BRIEF-Fastenal reports 2017 first quarter earnings
GE,GE Nigeria workers cordon off headquarters over salary dispute
GM,"In proxy fight, Greenlight says GM misrepresented its stock plan",Greenlight's Einhorn: GM share plan would preserve automaker's cash,Greenlight Capital nominates three directors to GM's board
GS,U.S. judge rejects Goldman Sachs' bid to narrow gender bias lawsuit
HOLX,Hologic faces U.S. patent lawsuit over menstrual bleeding device,Hologic faces U.S. patent lawsuit over menstrual bleeding device
INTC,BRIEF-Intel promotes three executives
JNJ,BRIEF-Phagelux announces collaboration with Johnson & Johnson Innovation for new antibacterial solution
KO,BRIEF-Coca Cola Bottling Co Consolidated and Coca-Cola Company enters into a non-binding letter of intent
L,Fitch Affirms Loews Corporation's IDR at 'A'; Outlook Revised to Negative
LM,BRIEF-Legg Mason reports AUM and flows for March 2017
MS,Morgan Stanley compliance chief Fenrich leaving for hedge fund,UPDATE 1-Morgan Stanley compliance chief Fenrich leaving for hedge fund
PG,BRIEF-P&G announces appointment of director
PPG,Rebel shareholder threatens legal action if Akzo rejects vote on chairman's dismissal,Elliott plans legal action if Akzo rejects vote on chairman dismissal,BRIEF-Hedge fund Elliott Advisors says met with PPG on Akzo Nobel,"Akzo Nobel reports Elliott, PPG for allegedly sharing 'sensitive' information"
QCOM,BlackBerry awarded $814.9 mln in Qualcomm arbitration,Qualcomm to pay BlackBerry $814.9 million to settle royalties dispute,BRIEF-BlackBerry awarded $814.9 mln in Qualcomm arbitration,BRIEF-Blackberry awarded $814.9 mln in Qualcomm arbitration
RIG,"Cigar Butts With Little Puffs - Low EV/EBIT Large Cap Strategy, Q1 Update",Buy Skyworks Solutions After Analyst Downgrade - Cramer's Lightning Round (4/11/2017),My Favorite Strategies In An Overvalued Market
SHW,BRIEF-Sherwin-Williams and Valspar reach agreement to sell Valspar's North American Industrial Wood Coatings Business to Axalta Coatings Systems
SWN,BRIEF-Southwestern Energy says CEO William Way's 2016 total compensation was $4.5 million
T,BRIEF-Former AT&T executive Ray Wilkins joins Caterpillar's board
UPS,BRIEF-UPS expanded global dangerous goods shipping program
VRSN,BRIEF-Verisign Inc CEO's 2016 total compensation $10.7 mln
WDC,"Western Digital says Toshiba breaching contract, wants exclusive chip talks","Western Digital says Toshiba breaching contract, wants exclusive chip talks",Western Digital says Toshiba chip unit sale violates joint venture contract
WFC,"Berkshire cuts Wells Fargo stake, pulls Fed application","Berkshire to pare Wells Fargo stake, pull Fed application",BRIEF-Berkshire Hathaway says intends to sell 1.9 mln Wells Fargo shares in near future
WMT,Wal-Mart offers discounts for online orders picked up in store
ZION,BRIEF-Kuwait's National Investments FY loss narrows
