AAPL,Wall Street slips on tech sector weakness,"Apple, suppliers drop on report of weak iPhone X demand",US STOCKS SNAPSHOT-Apple and its suppliers weigh on Wall Street,"CORRECTED-US STOCKS-Wall St set to open lower as Apple, chipmakers weigh",US STOCKS SNAPSHOT-Wall St opens lower as Apple weighs,Apple suppliers drop on report of weak iPhone X demand; analysts' views mixed
AMZN,BRIEF-Amazon Canada Says More Than 4 Mln Trialed Prime In One Week In Holiday Season
BAC,"BRIEF-Arris International, Units, Bank Of America, Other Lender Parties Entered Fourth Amendment"
CB,BRIEF-Chubb Estimates One-Time Benefit Of Over $250 Mln From New U.S. Tax Law
CF,BRIEF-Cf Industries Announces Early Tender Results
CMI,"BRIEF-Kirloskar Oil Engines Says Report On Deal With Cummins Is ""Factually Incorrect"""
COF,BRIEF-Capital One Financial Expects To Maintain Quarterly Dividend Of $0.40 Per Share
MNK,Mallinckrodt to buy Sucampo for about $840 million,"BRIEF-Sucampo Pharma Says If Merger Agreement Terminated, Co Agreed To Pay Mallinckrodt Fee Of $44 Million",BRIEF-Mallinckrodt To Buy Sucampo Pharmaceuticals For About $1.2 Bln,Mallinckrodt to buy Sucampo Pharmaceuticals for about $1.2 bln
PYPL,BRIEF-Paypal Holdings Drew Down $1 Billion Under Its 364-Day Delayed-Draw Term Loan Credit Facility 
RIG,Wall Street Breakfast: Stocks Flat As Markets Reopen,Non-U.S.-Listed Offshore Drillers Ahead Of 2018
