GM,Opel lost around $250 million in second-quarter: report
OXY,Occidental ships first crude cargo from Corpus Christi after Harvey
PSX,Phillips 66 says preparing to resume ops at Sweeny refinery in Texas
SLB,Moscow says Schlumberger Russian oil services deal held up by U.S sanctions: reports
UNP,Union Pacific says Arkema chemical plant fire hindering line repairs,Union Pacific says Arkema chemical plant fire hindering line repairs
WFC,TIMELINE-Unraveling of Wells Fargo sales scandal
XOM,Exxon restarting second-largest U.S. refinery
