AA,BRIEF-Alcoa reaches early termination agreement for power contract tied to curtailed rockdale smelter in Texas,BRIEF-Luminant to close two Texas power plants
AAPL,Qualcomm files lawsuits in China to ban iPhones,Qualcomm files lawsuits in China to ban iPhones - Bloomberg,Activists urge Apple to drop apps that play up Philippine drugs war
ADS,BRIEF-Alliance Data provides card services performance update for September 2017
AFL,BRIEF-Aflac will soon float about 60 bln yen in yen-denominated hybrid bonds - Nikkei
AMZN,Amazon Studios chief Roy Price suspended following harassment allegation,First spending boost in years set to pad tech stock earnings,Amazon steps up UK expansion drive with new distribution center,Amazon to open new distribution centre in north west England
APD,Industrial gases firms eye Linde-Praxair parts: Frankfurter Allgemeine
BA,Boeing passenger jets have falsely-certified Kobe Steel products: source,Boeing passenger jets have falsely-certified Kobe Steel products-source
BAC,"Bank of America grows Merrill Edge reach to customers with thousands, not millions","CORRECTED-Bank of America grows Merrill Edge reach to customers with thousands, not millions",Fitch: Strong Earnings Momentum for Bank of America in 3Q17,BRIEF-Bank of America posts qtrly earnings per share of $0.48,Bank of America profit rises 15 percent on lower costs,BRIEF-Bank of America Q3 results press release
BLK,BlackRock's Fink warns global surprise could drive stock market correction,Blackrock's Fink warns global surprise could drive major market correction
CMI,BRIEF-Cummins announces proposal to implement unilateral shareholder by-law amendment power
COF,"BRIEF-Walter Investment Management says entered into a clean-up call agreement with Capital One, National Association​"
EFX,IRS puts Equifax contract on hold during security review,Equifax says systems not compromised in latest cyber scare
FB,"Facebook will help investigators release Russia ads, Sandberg tells Axios","U.S. Congress tangles with Facebook, other social media firms over Russia probe"
GD,"Defense contractors Thales, General Dynamics hit with patent lawsuits"
GS,Goldman exploring options for stake in Weinstein Co
HON,BRIEF-Honeywell names Brian S. Cook global head of M&A
JBHT,BRIEF-J.B. HUNT TRANSPORT SERVICES Q3 EARNINGS PER SHARE $0.91
JNJ,J&J psoriasis drug gets expanded U.S. approval for teens
JPM,"JPMorgan's card gamble lures millennial travelers, squeezes competitors","JPMorgan's card gamble lures millennial travelers, squeezes competitors"
LMT,Swiss helicopter maker plans $154 mln capital increase -source
MSFT,BRIEF-Bit Evil signs non-disclosure agreement with Microsoft Corp
NFLX,"Wall Street raises targets on Netflix, citing price increases","Wall Street raises targets on Netflix, citing price increases"
OMC,BRIEF-Omnicom Group declares dividend increase
PCG,PG&E falls as California wildfires spark investor concerns
PNC,Fitch: PNC Continues to Report Solid Earnings,BRIEF-PNC Financial expects modest growth in Q4 loans vs Q3 - conf call,BRIEF-PNC Reports Q3 2017 Results,PNC Financial's profit beats estimates on higher interest income,BRIEF-Pnc reports Q3 2017 earnings per share of $2.16,PNC Financial's profit rises 14.1 pct on higher interest rates
QCOM,Qualcomm files lawsuits in China to ban iPhones,Qualcomm files lawsuits in China to ban iPhones - Bloomberg,"BRIEF-Qualcomm asks China to halt manufacture, sale of Apple iPhones - Bloomberg"
TXT,Swiss helicopter maker plans $154 mln capital increase -source
WDC,Toshiba discussing joint investment in chips with Western Digital,Toshiba discussing joint investment in chips with Western Digital's Sandisk
WFC,"Wells Fargo revises expense outlook, signaling profit difficulties ahead",Wells Fargo $1 billion accrual due to talks with U.S. Justice Department,URGENT-Wells Fargo $1 bln accrual due to talks with U.S. Justice Department,BRIEF-Wells Fargo reports Q3 earnings per share $0.84,"Wells Fargo hit by legal charges, mortgage banking slump"
XOM,BRIEF-ExxonMobil expanding New Jersey research and engineering center
