A,BRIEF-Agilent Technologies increased size of board from 10 to 11 members
AA,Alcoa trims forecast for earnings measure,Alcoa trims forecast for earnings measure,BRIEF-Alcoa Q2 earnings per share $0.40
AAPL,Four Apple contractors accuse Qualcomm of antitrust violations,Qualcomm's profit forecast disappoints as Apple battle takes toll,Four Apple contractors accuse Qualcomm of antitrust violations,Qualcomm's profit slumps amid Apple battle,Florida man settles SEC insider trading charges over Apple takeover,Florida man settles SEC insider trading charges over Apple takeover,Four Apple contractors accuse Qualcomm of antitrust violations,Apple names new managing director for China amid localization drive,BRIEF-Apple names Isabel Ge Mahe as managing director of Greater China
AGN,BRIEF-Allergan submits investigational NDA for rtgel in combination with botox,BRIEF-Allergan appoints Joseph Boccuzi to its board
AMZN,Activist Jana cashes out of Whole Foods following Amazon deal,Amazon launches shopping social network Spark for iOS
APA,BRIEF-Apache Corp files for potential mixed shelf offering
AXP,AmEx profit dips as it splurges on customer rewards,BRIEF-American Express' Q2 EPS $1.47,BRIEF-American Express Q2 earnings per share $1.47,American Express profit dips 36 pct
BAC,Fitch: Continued Earnings Momentum for Bank of America in 2Q17,BRIEF-Global Logistic Properties says Bank Of America Corp raised deemed interest in Co,BRIEF-Bank Of America files final term sheet related to its $2.5 billion offering,BRIEF-Bank Of America files final term sheet related to its offering of $1 billion floating rate senior notes
BDX,BRIEF-BD receives FDA clearance for new immunological diagnostic system
C,BRIEF-Citigroup sets quarterly dividend of $0.32 per share,"BRIEF-William Thompson, Jr. to retire from Citi board"
CPB,BRIEF-Campbell appoints Shakeel Farooque as head of digital & e-commerce organization,BRIEF-Campbell takes actions to reshape portfolio toward faster-growing spaces outlines fiscal 2018 priorities,BRIEF-Campbell reaffirms its full-year guidance for fiscal 2017
CVX,Sri Lankan shares fall to 1-mth low; Chevron Lubricants leads
DAL,BRIEF-Delta to expand trans-pacific service with nonstop Shanghai-Atlanta flight
DOW,China's CITIC Agri Fund buys Dow corn seed assets for $1.1 billion
EOG,BRIEF-EOG expects Q2 non-cash net gain of $9.4 mln on mark-to-market of its financial commodity derivative contracts
FB,Facebook in talks with publishers on supporting subscription models,Facebook to launch news subscription product - TheStreet
GE,General Electric awarded contract worth up to $409 million: Pentagon,EU mergers and takeovers (July 19),BRIEF-General Electric announces agreement with PT Pembangkitan Jawa Bali
GLW,BRIEF-Corning acquires SpiderCloud Wireless
GM,GM joins other carmakers investing in self-driving startup Nauto,GM cleared in first case over updated ignition switch
GOOG,Google redesigns mobile search app with personalized 'feed'
GOOGL,Google redesigns mobile search app with personalized 'feed'
GS,Morgan Stanley claims another trading victory over rival Goldman Sachs,Morgan Stanley gives Goldman a lesson in diversity,"KBW downgrades Goldman, calls it 'show-me' stock",Fitch: Low Volatility Impacts Goldman Sachs' 2Q17 Earnings
HOG,Justice Department expected to drop $3 million Harley-Davidson emissions penalty: sources,Justice Department expected to drop $3 mln Harley-Davidson emissions penalty - sources
IBM,"US STOCKS SNAPSHOT-S&P, Nasdaq at records as Vertex rallies; IBM slips",London Stock Exchange Group tests blockchain for private company shares,"IBM misses revenue estimates, weighed down by legacy businesses"
JNJ,China adds blockbuster drugs to insurance list after price cuts
JPM,JPMorgan posts higher profit; shares dip on net interest income view
KMI,Kinder Morgan's Trans Mountain to see little major work this year,BRIEF-Kinder Morgan Q2 earnings per share $0.15
LH,BRIEF-LabCorp introduces new ADAMTS13 test for rare blood clot disorder
LMT,BRIEF-U.S. Air Force awards Lockheed Martin $37 million for new JASSM-ER wing design
MA,BUZZ-Payment processors rise after UK's halt on card fees,BRIEF-TGI Fridays to implement bar tab from Mastercard and Oracle
MKC,Reckitt cuts the mustard with $4.2 billion food business sale,BRIEF-Mccormick & Co says Reckitt Benckiser food business deal expected 5pct accretive to adjusted EPS in year 1,BRIEF-Reckitt Benckiser sell its food business to McCormick for $4.2 bln,CORRECTED-McCormick to buy Reckitt's food unit for $4.2 bln,BRIEF-McCormick to acquire Reckitt Benckiser's food division for $4.2 bln
MS,Morgan Stanley claims another trading victory over rival Goldman Sachs,Morgan Stanley chooses Frankfurt as EU hub post Brexit: source,"As Morgan Stanley hits wealth records, analysts ask how long it can last",Morgan Stanley gives Goldman a lesson in diversity,Morgan Stanley chooses Frankfurt as EU hub post Brexit - source,BRIEF-Morgan Stanley has chosen Frankfurt as its post-Brexit EU hub- Press Association,BRIEF-Morgan Stanley reports second quarter results,Morgan Stanley's quarterly profit rises 11.4 pct
MSFT,BRIEF-Dun & Bradstreet: Relationship with Microsoft won't impact 2017 results,BRIEF-Dun & Bradstreet to team up with Microsoft for its cloud business
MTB,BRIEF-M&T Bank Corporation announces second quarter results
MYL,BRIEF-Theravance Biopharma and Mylan announce positive results from 12-month phase 3 safety study of revefenacin
NTRS,BUZZ-Northern Trust Corp: Set for worst day since Brexit vote,BRIEF-Northern Trust Corp reports Q2 earnings of $1.12 per share,UPDATE 2-Northern Trust to set up EU bank in Luxembourg ahead of Brexit,Northern Trust to set up EU bank in Luxembourg ahead of Brexit
OKE,BRIEF-Oneok enters into equity distribution agreement
ORCL,BRIEF-TGI Fridays to implement bar tab from Mastercard and Oracle
PBCT,BRIEF-People's United Bank acquires Leaf Commercial Capital
PRU,BRIEF-Prudential Financial says Assets Under Management $1.105 trillion
QCOM,Four Apple contractors accuse Qualcomm of antitrust violations,Qualcomm's profit forecast disappoints as Apple battle takes toll,Four Apple contractors accuse Qualcomm of antitrust violations,BRIEF-Qualcomm reports quarterly GAAP EPS of $0.58,Qualcomm's profit slumps amid Apple battle,Four Apple contractors accuse Qualcomm of antitrust violations
RIG,Here's Why Transocean Agreed To This Bad Contract
RTN,Trump to nominate Raytheon lobbyist for Army secretary,Trump eyes Raytheon executive for army secretary-source
SHW,BRIEF-Sherwin-Williams sets regular quarterly dividend of $0.85 per share
SJM,BRIEF-J. M. Smucker Company announces qtrly dividend increase of 4 pct to $0.78 per share
SLG,BRIEF-SL Green Realty posts Q2 FFO per share $1.78
TXT,Textron's profit beats as it reaps rewards of Arctic Cat buy,BRIEF-Textron continues to make progress with Arctic Cat integration - conf call,BRIEF-Textron reports Q2 adjusted earnings per share $0.60 from continuing operations,Textron profit falls 13.6 pct
USB,"Fitch: USB 2Q17 Earnings Down, Despite Loan Growth and Higher Rates",U.S. Bancorp's profit beats on higher rates,U.S. Bancorp's profit beats on higher rates,BRIEF-U.S. Bancorp reports Q2 earnings per share $0.85
V,BUZZ-Payment processors rise after UK's halt on card fees
VRTX,Wall Street at new highs as tech breaches dot-com era record,"US STOCKS SNAPSHOT-S&P, Nasdaq at records as Vertex rallies; IBM slips",Vertex Pharma shares hit life high as cystic fibrosis data wows
WDC,Toshiba says it again is blocking Western Digital access to chip JV,Toshiba says resumed blocking Western Digital access to chip JV
WLTW,BRIEF-Willis Towers Watson launches cyber work diagnostic tool
WMT,Federal judge rejects Walmart's bid to scuttle worker's religious bias lawsuit
