AAPL,"Apple, Qualcomm battle over possible ban on some U.S. iPhone imports",Apple nabs Oprah as top talent flocks to digital entertainment,Apple poaches senior self-driving engineer from Waymo,Apple poaches senior self-driving engineer from Waymo,Apple signs Oprah Winfrey to multi-year program deal
ADM,"UPDATE 1-U.S., China trade fight 'will lead to serious consequences' -Cargill"
AMGN,"Novartis touts effectiveness, safety of autoimmune drug copies"
AMZN,Exclusive: Amazon to tap Brazil beauty obsession with cosmetics partners
BA,Boeing creates one-stop shop for jets and services in Airbus battle,Boeing sales chief says Rolls setbacks not impacting 787 sales,UPDATE 1-Boeing sales chief says Rolls setbacks not impacting 787 sales,Boeing sales chief says Rolls setbacks not impacting 787 sales,FOCUS-Boeing creates one-stop shop for jets and services in Airbus battle,"Asked about a mid-market plane, Rolls CEO says gap in the market for a reason","Asked about a mid-market plane, Rolls CEO says gap in the market for a reason"
BAC,Bank of America picks ex Macron adviser Mourad to run investment banking for France: sources
BEN,MOVES-Franklin Templeton hires Jennifer Ockwell as head of UK Institutional
BWA,BorgWarner to restate certain financial statements,BorgWarner to restate financial statements
C,Citigroup to pay $100 million to settle U.S. Libor rigging probe,Citigroup to pay $100 million in rate-rigging settlement
CB,6 Upcoming Dividend Increases
CMCSA,Comcast gains unconditional EU antitrust approval to buy Sky,Comcast’s record all-cash Fox bid signals aggressive lending push
CVX,Chevron starts second production unit at Wheatstone LNG in Australia
FDX,FedEx calls U.S. tariffs on Chinese goods 'counterproductive',FedEx calls U.S. tariffs on Chinese goods 'counterproductive'
JNJ,"Novartis touts effectiveness, safety of autoimmune drug copies"
LMT,Lockheed Martin wins $503 million U.S. defense contract: Pentagon
LYB,Deals of the day-Mergers and acquisitions,LyondellBasell in exclusive talks to acquire control of Braskem,"Petrobras says will analyze potential Braskem deal btwn Odebrecht, LyondellBasell",LyondellBasell says in talks on Braskem deal
MS,Italy court rules it cannot hear Morgan Stanley derivatives case,Italy court rules it cannot hear Morgan Stanley derivatives case - sources
NFLX,Public and private French TV channels to launch Netflix rival
QCOM,"Apple, Qualcomm battle over possible ban on some U.S. iPhone imports",Qualcomm-NXP deal still waiting for China nod: sources,Qualcomm extends cash tender offer to buy NXP shares
RIG,Energy Recap: OPEC Meeting On The Horizon,"Transocean Retires 4 Rigs, Will Write Off $520 Million"
STT,"MOVES- State Street, Legal & General, Franklin Templeton",MOVES-State Street names head of sector solutions for EMEA
T,"AT&T CEO says ready to invest, WarnerMedia rebranding unveiled","AT&T CEO says ready to invest, keep culture at Time Warner -CNBC",Comcast’s record all-cash Fox bid signals aggressive lending push,AT&T closes $85 billion deal for Time Warner
WFC,Wells Fargo receives final approval to settle $142 million lawsuit,Wells Fargo settles retail sales lawsuit for $142 mln
