AA,Alcoa asks U.S. government for tariff exemption on Canadian aluminum,UPDATE 1-Alcoa asks U.S. government for tariff exemption on Canadian aluminum
AAPL,"Apple, YouTube, and others drop conspiracy theorist Alex Jones",Apple removes most of U.S. conspiracy theorist's podcasts from iTunes,"TSMC computer virus hit may delay Apple shipments, but impact limited: analysts"
BLK,"MOVES- Blackrock, BNP Paribas, Credit Suisse"
CAH,UPDATE 1-Drug distributor Cardinal's profit beats on pharma unit strength,Cardinal Health posts fourth-quarter loss
CB,New York's Cuomo rejects NRA claim that 'blacklisting' jeopardizes mission
CSCO,Arista to pay $400 million to Cisco to resolve court fight,REFILE-BRIEF-Arista Networks To Pay Cisco $400 Mln To Resolve Pending Litigation,Arista to pay $400 million to Cisco to resolve court fight
D,Dominion does not expect U.S. court order to hold up Atlantic Coast pipe,US court vacates two permits for Dominion Atlantic Coast natgas pipe
FB,Facebook in talks with banks to expand customer service,"Apple, YouTube, and others drop conspiracy theorist Alex Jones",Facebook asks US banks for financial info to boost user engagement-WSJ
GS,Goldman Sachs names Jim Esposito co-head of trading division
HOG,Harley seeks alliance for lightweight bikes to grow India business,Harley seeks alliance for lightweight bikes to grow India business
MAR,"Marriott sees revenue weakness in third quarter, shares fall"
MOS,CORRECTED-Mosaic's profit dips 43 percent on acquisition costs,"Mosaic tops profit estimates led by higher phosphate margins, Brazil sales"
PEP,PepsiCo veteran Ramon Laguarta to replace Indra Nooyi as CEO,PepsiCo's Indra Nooyi to step down as CEO
REGN,"Regeneron to invest $100 million in bluebird, jointly develop cancer therapies"
RIG,Transocean - Second-Quarter Results Analysis
SLB,Schlumberger appoints shale innovator Mark Papa to board
SRE,Sempra Energy CEO 'very optimistic' about talks with Elliott Management
T,U.S. argues judge failed to take its arguments into account in AT&T trial
TSN,Tyson Foods beats profit estimates on strong beef demand,"Tyson sales miss estimates on lower beef, pork prices"
WMT,Thai Union quarterly profit sinks 99 pct on Walmart settlement
WYNN,"Wynn Resorts settles with Elaine Wynn, names industry veteran vice-chairman"
