AAPL,"Berkshire doubles Teva stake, adds to Apple, ends a newspaper bet",Highlights: Hedge funds chomped on FAANGs during first quarter tech turmoil
ADM,"ADM, Bunge say they can navigate U.S.-China trade tensions",ADM can manage supply chain through U.S.-China trade tensions: CFO
AMGN,BRIEF-Amgen Receives European Commission Approval For Repatha (Evolocumab)
AMZN,BRIEF-Amazon Announces New Tucson Fulfillment Center,Highlights: Hedge funds chomped on FAANGs during first quarter tech turmoil
BA,How Rusal escaped the noose of U.S. sanctions
BEN,BRIEF-Franklin Resources Inc Reports 13.3 Percent Passive Stake In Talos Energy Inc As Of May 10
BLK,Cboe and BlackRock to launch corporate bond index futures,"BRIEF-Cboe, IHS Markit And BlackRock Join Forces To Launch First U.S. Corporate Bond Index Futures"
C,BRIEF-Citigroup Inc Files Prospectus Supplement Related To Offering Of $1.25 Billion 4.044% Fixed Rate/Floating Rate Callable Senior Notes Due 2024,BRIEF-Citigroup Inc Files Prospectus Supplement Related To Offering Of $350 Million 4.450% Subordinated Notes Due 2027,BRIEF-Citigroup Inc Files Prospectus Supplement Related To Offering Of $1 Billion Floating Rate Notes Due 2024
CI,BRIEF-Express Scripts On Track To Close Deal With Cigna Before End Of Year
COP,Enough global oil supplies to avoid possible disruptions in Caribbean - U.S.
CSCO,"Cisco's tepid forecast clouds quarterly beat, shares fall",BRIEF-Cisco Q3 Non-GAAP Earnings Per Share $0.66,Cisco quarterly revenue rises 4.4 pct
D,BRIEF-Dominion Energy Statement In Response To U.S. Fourth Circuit Court Of Appeals Atlantic Coast Pipeline Order
DIS,Lachlan Murdoch to replace brother James as Fox CEO after Disney deal,CORRECTED-UPDATE 1-Rupert Murdoch's son Lachlan to become Fox CEO after Disney deal,RPT-REFILE-Lachlan Murdoch to be CEO of new Fox after Disney deal,REFILE-Lachlan Murdoch to be CEO of new Fox after Disney deal,BRIEF-Disney Considers Letting Pixar Co-Founder Lasseter Return - WSJ
DUK,BRIEF-Duke Energy Says To Sell Five Small Hydroelectric Plants To Northbrook Energy
EFX,Wall St. gains as small-cap Russell 2000 hits record
ETN,"BRIEF-Ford Restarting F-150, Super Duty Production Ahead Of Schedule After Fire At Magnesium Parts Supplier"
FB,"ISS recommends votes against Facebook CEO Zuckerberg, 4 other directors",U.S. investigating Cambridge Analytica: New York Times,France’s Macron to hold 'tough talks' with Facebook's Zuckerberg,Facebook CEO to meet with European Parliament to talk privacy -- company,Highlights: Hedge funds chomped on FAANGs during first quarter tech turmoil
FOXA,Lachlan Murdoch to replace brother James as Fox CEO after Disney deal,BRIEF-Lachlan Murdoch Named CEO Of Proposed New Fox
GE,BRIEF-GE Unveils Cross-Fleet Gas Turbine Capabilities That Can Increase Performance And Reliability Of Other Oem Fleets
GOOG,Highlights: Hedge funds chomped on FAANGs during first quarter tech turmoil
GOOGL,Highlights: Hedge funds chomped on FAANGs during first quarter tech turmoil
GS,"Goldman aims to preserve pre-IPO culture, even as partnership dwindles"
IBM,BRIEF-Finjan Holdings Says Unit  Entered Into A Patent Assignment And Support Agreement With International Business Machines Corporation
IP,International Paper says it will not make hostile bid for Smurfit,BRIEF-International Paper Says It Supports Irish Takeover Panel Timeline of Smurfit
K,Venezuela reactivates Kellogg plant after company pullout,Venezuela reactivates Kellogg plant after company pullout
KMI,BRIEF-Alberta Premier Notley says confident will eventually get to right place on Kinder Morgan Canada pipeline,"Canada ready to cover Kinder Morgan loss, sees outside interest"
LUV,BRIEF-Southwest Airlines Authorized A New $2.0 Billion Share Repurchase Program,Southwest Airlines raises dividend by 28 pct on tax reform gains
M,"Macy's lifts forecast, says 'every week was good' in first quarter","RPT-UPDATE 2-Macy's shares surge after same-store sales, profit trounce estimates",US STOCKS SNAPSHOT-Wall St opens flat as gains in retail stocks offset losses in energy shares,BRIEF-Macy's Inc Reports Q1 EPS $0.48 Excluding Items,"Macy's same-store sales growth trumps estimates, shares rise"
MDT,BRIEF-Medtronic Begins U.S. Study To Evaluate Treatment Of Bifurcation Lesions In Patients With Coronary Artery Disease
MET,MetLife's insurance plan covers diabetic's amputation after a car crash - 9th Circuit,BRIEF-MetLife Names Bill O’Donnell As U.S. CFO,MetLife names Bill O'Donnell as U.S. CFO
MRK,Merck's Keytruda boosts response in hard-to-treat lung cancer,BRIEF-Eiger Announces Expanded License Agreement With Merck For Lonafarnib
MSFT,Microsoft urges appeals court to limit sovereign immunity at PTAB,BRIEF-Microsoft/Dell Enter Transformative Agreement With U.S. Intelligence Community,BRIEF-Microsoft Corp is planning to release a line of lower-cost surface tablets - Bloomberg
NFLX,Netflix's next act: feeding the service with its own movies,Highlights: Hedge funds chomped on FAANGs during first quarter tech turmoil
NKE,"Nike, H&M and Burberry join forces for sustainable fashion"
OI,BRIEF-Owens-Illinois Inc Announces Plant Closure In Atlanta
ORCL,BRIEF-Oracle Buys Datascience.Com
PGR,BRIEF-Progressive Corp Says Board Of Directors Renewed Co's Authorization To Repurchase Up To 25 Mln Of Common Shares,"BRIEF-Progressive Corp Reports April Net Premiums Written $3,226.9 Mln Versus $2,704.0 Mln"
PRGO,"BRIEF-Aspen's Infant Formula Unit Is Said To Draw Reckitt, Perrigo - Bloomberg"
RIG,Transocean (RIG) Presents At Citi 2018 Global Energy & Utilities Conference - Slideshow
RRC,BRIEF-Range Resources Says Board Appointed Mark Scucchi As CFO
RTN,"BRIEF-Sparton, Raytheon Partner On Mine Neutralization System"
SBUX,Starbucks says aims to triple China revenue by 2022,BRIEF-Starbucks Expects To More Than Triple Revenue In China Over Next 5 Years
T,"BRIEF-Voip-Pal's Patent Infringement Lawsuits Vs Twitter, Verizon, AT&T Authorized To Move Forward"
VZ,"BRIEF-Voip-Pal's Patent Infringement Lawsuits Vs Twitter, Verizon, AT&T Authorized To Move Forward",BRIEF-Allied Minds Says Unit Jointly Announces First Successful Testing Of 4G LTE Technology Over CBRS Spectrum
WMT,BRIEF-Lord & Taylor To Roll Out New Flagship Store On Walmart.com In Coming Weeks
XRX,Xerox names John Visentin as CEO after scrapping Fujifilm deal,Xerox names John Visentin as new CEO,BRIEF-Xerox Announces John Visentin As New CEO
ZTS,Zoetis to buy veterinary diagnostics firm Abaxis for $1.9 billion,"BRIEF-Abaxis Inc - Upon Termination Of Merger By Co Or Zoetis Upon Specified Conditions, Termination Fee Of $70 Mln May Be Payable By Co To Zoetis","BRIEF-Zoetis Says Upon Deal Termination By Abaxis Or Co, Termination Fee Of $70 Mln May Be Payable By Abaxis",BRIEF-Zoetis To Acquire Abaxis for about $2 Bln In Aggregate,Zoetis to buy Abaxis for $1.9 bln in cash
