AAPL,"Google unveils new Pixel phone, adds tablet in Apple challenge"
AMZN,Microsoft expands cloud service in push for $10 billion Pentagon contract
BA,Boeing surprises with jump in September plane deliveries,Boeing September 737 deliveries dwarf August numbers
C,"Citigroup, Deutsche Bank face Australian court in landmark cartel case"
CB,All Eyes On Treasuries (Wall Street Breakfast Podcast),Wall Street Breakfast: Treasury Yield Hits Multi-Year High,Quarterly Review Of DivGro: Q3 2018
CMCSA,Deals of the day-Mergers and acquisitions,Comcast's $40 billion Sky takeover becomes unconditional
CVX,Chevron eyes Houston Ship Channel for second U.S. Gulf refinery,Chevron eyes Houston Ship Channel for second U.S. Gulf refinery,Unions accuse Chevron of 'massive' tax avoidance via the Netherlands,"Unions accuse Chevron of ""massive"" tax avoidance via the Netherlands"
DHI,D.R. Horton sees 2018 homes sales below estimates,D.R. Horton sees 13 pct rise in 2018 home sales
EOG,EOG warns oil and gas hedges will hurt third-quarter results
FB,WhatsApp builds system to comply with India's payments data storage norms,WhatsApp builds system to comply with India's payments data storage norms
FOXA,Deals of the day-Mergers and acquisitions,Comcast's $40 billion Sky takeover becomes unconditional
GOOG,Alphabet to shut Google+ social site after user data exposed,Irish data regulator seeks information from Google on security bug
GOOGL,Alphabet to shut Google+ social site after user data exposed,Irish data regulator seeks information from Google on security bug
IFF,UPDATE 1-Swiss scent maker Givaudan reports 9.8 pct Q3 sales hike
JNJ,J&J's Stelara succeeds in chronic bowel disease study
MSFT,Microsoft to invest in Southeast Asian ride-hailing firm Grab,Microsoft expands cloud service in push for $10 billion Pentagon contract,Exclusive: Microsoft's $7.5 billion GitHub deal set for EU approval - sources
PEP,"Coke, Pepsi, Nestle top makers of plastic waste - Greenpeace"
PFE,U.S. Supreme Court declines antitrust case against Pfizer over Lipitor
PG,"P&G gets steel tariff exemption for Gillette, Venus razors"
PPG,Trian Fund takes 2.6 percent stake in PPG Industries: WSJ
QCOM,Qualcomm adds two new members to its board
RIG,Ensco: Consolidation Reduces Risk,BRIEF-Ocean Rig UDW Announces Date Of Extraordinary General Meeting
SLB,"Russia's RDIF, Schlumberger aim to reach Eurasia Drilling deal soon -TASS"
XOM,Exxon puts $1 million into climate group promoting U.S. carbon tax,REFILE-Exxon puts $1 mln into climate group promoting U.S. carbon tax
