ADI,BRIEF-Analog Devices Announces Offering And Pricing Of Senior Notes
AES,BRIEF-AES Says CEO Gluski's 2017 Total Compensation Was $9.4 Mln
ALB,BRIEF-Albemarle Receives Increase In Lithium Quota For Chile Operations,Chile approves increase in lithium quota for Albemarle
AMZN,Hold the iPhone! Amazon primed to be larger than Apple
ANTM,BRIEF-Anthem Inc's Former CEO's FY17 Total Compensation Was $18.6 Mln
AVGO,Intel considers deals including bid for Broadcom - WSJ,BRIEF-Intel Considers Possible Bid For Broadcom  - WSJ,BRIEF-Broadcom Ltd Files Proxy Statement With U.S. SEC Related To Redomiciling Plans,"Broadcom promises on security, Qualcomm revamps board",Broadcom says will not sell national security assets to foreign firms,BRIEF-Broadcom Says Will Not Sell Any Critical National Security Assets To Any Foreign Companies​
BA,BRIEF-Turkish Airlines To Purchase Total Of 60 Wide Body Aircraft,Exclusive: Boeing has 'cash horsepower' for targeted acquisitions - CEO
BK,BRIEF-BNY Mellon CEO Charles Scharf's 2017 Total Compensation $17.1 Mln
CA,Toymakers tumble as Toys 'R' Us prepares to liquidate
CAH,BRIEF-Cardinal Health Recommends Shareholders Reject The Below-Market Mini-Tender Offer By TRC Capital Corporation
CCL,BRIEF-Carnival Corp Files For Potential Mixed Shelf Offering
CFG,BRIEF-Citizens Financial Group Says CEO Bruce Van Saun's 2017 Total Compensation Was $8.5 Mln
CMCSA,Comcast and Murdoch's Fox in regulatory race for Sky approval,EXPLAINER-Comcast and Murdoch in regulatory race for Sky approval
CNC,BRIEF-Centene Corp CEO's 2017 Total Compensation Was $25.3 Mln
COF,Fed says will not object to revised capital plan from Capital One
CRM,BRIEF-Dropbox And Salesforce Form Strategic Partnership
CVX,"South Africa watchdog approves $900 million Sinopec, Chevron deal","S.Africa's competition watchdog approves Sinopec, Chevron deal",BRIEF-SA's ‍Competition Tribunal Conditionally Approves Merger of Sinopec Corp And Chevron South Africa​
DHR,BRIEF-Danaher To Acquire Integrated DNA Technologies
DIS,BRIEF-Walt Disney Replaces Existing $2.5 Bln 364-Day Credit Agreement,Disney shareholders vote against CEO Iger's pay package
DO,BRIEF-Diamond Offshore Drilling Files For Mixed Shelf Offering
DUK,BRIEF-Duke Energy Says CEO Good's 2017 Compensation Was $21.4 Mln
EIX,BRIEF-Edison International Says Priced Offering Of $550 Million 4.125% Senior Notes Due 2028
FB,BRIEF-Warner Music Says Signs Licensing Deal With Facebook
FMC,"BRIEF-FMC Announces Executive Leaders For Planned New Lithium Materials Company, Appoints New FMC Chief Financial Officer"
GE,Exclusive: GE explores divesting electrical engineering business - sources
GM,"GM confirms investment in South Korea business, flags first quarter 'cash crisis'"
GS,Goldman CEO Blankfein prepares to exit as soon as year-end: WSJ,Factbox: Black-belt versus DJ: contenders to be next Goldman CEO,BRIEF-Lloyd Blankfein Prepares To Exit Goldman Sachs As Soon As Year's End - WSJ,Goldman CEO Blankfein prepares to exit as soon as year-end - WSJ,"China's Hua Medicine plans $400 million Hong Kong IPO, led by Goldman: sources","China's Hua Medicine plans $400m Hong Kong IPO, led by Goldman - sources"
GT,BRIEF-Goodyear Tire & Rubber Says CEO Kramer's FY 2017 Total Compensation Was $10.8 Mln Vs $19.8 Mln In FY 2016
HON,BRIEF-Intellicheck And Honeywell Settle All Pending Patent Matters,6th Circuit says Honeywell didn't owe retirees benefits after CBA expired
HPQ,BRIEF-HP Inc Announces Cash Tender Offer For Up To $1.75 Bln Of Debt Securities
HUM,BRIEF-Humana Inc Files For Potential Mixed Shelf Offering; Size Not Disclosed
INTC,BRIEF-Intel when asked about report of potential bid for Broadcom says 'focus is on integrating' previous acquisitions,Intel considers deals including bid for Broadcom - WSJ,BRIEF-Intel Considers Possible Bid For Broadcom  - WSJ
JPM,"MOVES-JPMorgan, Multrees, Newmark Knight Frank",MOVES-Former BofA exec joins JPMorgan's oil & gas investment banking team,MOVES-JP Morgan hires Wheeler for EMEA oil and gas
KR,BRIEF-Kroger Cincinnati/Dayton Associates Ratify New Contract With UFCW 75
LH,BRIEF-Covance Forms Immunology & Immunotoxicology Unit Focused On Biologic Drug Development
MAT,Toymakers tumble as Toys 'R' Us prepares to liquidate
MDT,BRIEF-Medtronic PLC Says ‍Approved Fiscal Year 2018 Q4 Cash Dividend Of $0.46/Ordinary Share
MRK,"Eisai clinches Merck deal to develop and sell cancer drug, shares soar"
NEM,BRIEF-Newmont Mining Corp Says CEO Gary Goldberg's FY 2017 Total Compensation Was $13.8 Mln Vs. $16.6 Mln In 2016 - SEC Filing
NFLX,Wall Street has never been so far behind on Netflix,Barack Obama in talks to create shows for Netflix: New York Times
PDCO,"BRIEF-Take-Two, SVB To Switch With Signet, Patterson In S&P 500"
PGR,BRIEF-Progressive Announces Public Offering Of Senior Notes,BRIEF-Progressive Corp Files For Potential Mixed Shelf Size Not Disclosed
PRGO,BRIEF-Perrigo Says Terminated Existing Credit Agreements,BRIEF-Perrigo - John Hendrickson's 2017 Total Compensation $8.3 Million Versus $5.8 Million In 2016
QCOM,"Broadcom promises on security, Qualcomm revamps board",BRIEF-Qualcomm Enters Credit Agreement Providing Senior Unsecured Delayed-Draw Term Facility Of $3 Bln,BRIEF-Qualcomm Extends Cash Tender Offer For All Outstanding Shares Of NXP,BRIEF-Qualcomm Board Names Jeffrey Henderson Non-Executive Chairman,Broadcom says will not sell national security assets to foreign firms
RTN,"Raytheon, Palantir win $876 million U.S. defense contract: Pentagon"
SIG,"BRIEF-Take-Two, SVB To Switch With Signet, Patterson In S&P 500"
T,BRIEF-Group Of 11 former DOJ officials file amicus curiae brief in suit between AT&T and DOJ – Court filing
UTX,BRIEF-United Technologies Says CEO's 2017 Total Compensation Was $15.8 Mln Vs $13.4 Mln In 2016
WFC,Colombian businessman's heirs lose lawsuit against Wells Fargo
WRK,BRIEF-WestRock Says Enters Into Credit Agreement
WYNN,Wynn Resorts to pay $2.6 billion to settle lawsuit with Japan's Universal,Wynn Resorts to pay $2.6 bln to settle lawsuit with Japan's Universal
XOM,Global gas markets ease as traders handle Papua outage; winter demand drops
