AAPL,Amazon to allow Apple Music on its Echo speakers
AMZN,Amazon to allow Apple Music on its Echo speakers,"Amazon sued for firing black, Latino drivers after background checks"
BA,Exclusive: Boeing eyes Lion Air crash software upgrade in 6-8 weeks
BMY,Bristol-Myers must face lawsuit alleging underpaid Medicaid rebates
CVS,U.S. judge raises prospect of not approving CVS-Aetna deal
DNB,Norway regulator finds 'insufficient' money laundering controls at DNB
FB,Instagram's new feature allows users to share stories with smaller group
GE,Former GE employees say insurance risks were ignored: WSJ
GM,GM's CEO to meet U.S. lawmakers next week over job cuts
GOOG,Does Google harm local search rivals? EU antitrust regulators ask
GOOGL,Does Google harm local search rivals? EU antitrust regulators ask
HON,Honeywell to shift global headquarters to Charlotte,Honeywell to shift global headquarters to Charlotte
HPQ,HP Inc revenue tops estimates on personal systems business
MAR,Marriott discloses data breach at Starwood
PVH,"PVH plans fixes for Calvin Klein, sees strong start to holidays"
PYPL,ECB takes on PayPal with instant payment system
UAL,"United moves deeper into Latin America with Avianca, Copa tie-up","United Continental close to sealing deal on Avianca loan, partnership - WSJ"
