CAT,Caterpillar leans on old playbook to cope with Trump tariffs
CMCSA,Breakingviews - Comcast overreaches for Sky with $40 bln knockout,Boutique firm Robey Warshaw delivered Comcast's knockout blow for Sky,Sky's independent directors recommend Comcast offer,"Fox plans to concede defeat in Sky battle, review stake: source","Fox plans to concede defeat in Sky battle, review stake - source"
CVX,Nigeria oil unions threaten nationwide strike over Chevron dispute
DUK,"Duke shuts natgas plant due to Florence floods, coal ash leak feared"
PYPL,PayPal ends business dealings with Alex Jones's Infowars
RIG,Another Contract In A Flurry Of Harsh-Environment Jobs
