BLK,BlackRock seeks 30 percent stake in Intesa's asset manager: sources,BlackRock seeks 30 pct stake in Intesa's asset manager-sources
GM,GM to build Chevrolet Blazer in Mexico,GM says will build Chevrolet Blazer in Mexico
HOG,Harley says EU duties could prompt price hikes
NFLX,Netflix communication head quits over 'insensitive' comment
SLB,Schlumberger oil services wins in U.S. Supreme Court on patent damages,U.S. Supreme Court backs Schlumberger on overseas patent damages
WMT,Walmart-Advent deal gets Brazil antitrust nod
