ABBV,BRIEF-AbbVie Gets Positive Recommendation From Pan-Canadian Oncology Drug Review For Venclexta
ABT,UPDATE 1-FDA approves Abbott's pediatric heart valve,FDA approves Abbott's pediatric heart valve
ACN,BRIEF-Accenture Invests In Software Provider Upskill
ADSK,BRIEF-Autodesk Inc Q4 GAAP Loss Per Share $0.79,Software maker Autodesk's fourth-quarter revenue rises 15.7 pct
AIZ,BRIEF-Assurant Revises Financing Plan For Acquisition Of TWG Holdings By Lowering Overall Equity Issuance
AMZN,Airbnb snags top Amazon executive in charge of Prime business,BRIEF-Amazon expands grocery delivery from Whole Foods market to Atlanta and San Francisco
AN,BRIEF-Autonation Says CEO's 2017 Total Compensation Was $12.2 Mln Vs. $11.1 Mln
AON,MOVES-Aon names Mike Edwards as partner in UK risk settlement team
AVGO,Exclusive: Secretive U.S. security panel discussing Broadcom's Qualcomm bid - sources,U.S. panel says concerns over Broadcom deal warrant full investigation -Treasury,RPT-Qualcomm takeover battle intervention shows U.S. security panel's expanding reach,U.S. security panel deals major blow to Broadcom's bid for Qualcomm,Qualcomm takeover battle intervention shows U.S. security panel's expanding reach,Qualcomm takeover battle intervention shows U.S. security panel's expanding reach
BA,Boeing lures Hawaiian Airlines from Airbus with new jet order,Boeing faces new petition for union at South Carolina plant
BBY,BRIEF-Best Buy Co Says CEO Joly Adopts Stock Trading Plan
BLK,"BlackRock, Soros may invest in Deutsche's asset management IPO: source","BlackRock, Soros interested in IPO of Deutsche Bank unit -source",BRIEF-BlackRock And Kyriba Announce Strategic Partnership To Help Optimize Liquidity Performance
BLL,BRIEF-Ball Corporation Prices $750 Million Of Senior Notes,BRIEF-Ball Corp Announces Public Offering Of Senior Notes,BRIEF-Ball Corp Files For Potential Mixed Shelf Size Not Disclsoed - SEC Filing
BMY,FDA approves new dosing for Bristol-Myers Squibb's Opdivo,FDA approves new dosing for Bristol-Myers Squibb's Opdivo,BRIEF-Bristol-Myers Squibb's Opdivo Now The First And Only FDA-Approved PD-1 Inhibitor To Offer Every Four-Week Dosing
C,Citigroup moving toward 'national digital bank': CFO,"Citigroup moving toward national digital bank, CFO says","Citigroup, Zurich Insurance consortium to develop cyber security norms: FT"
CAG,"BRIEF-Conagra Brands, J.M. Smucker Terminate Deal For Wesson Oil Business Sale",BRIEF-J. M. Smucker Announces Termination Of Deal To Buy ConAgra's Wesson Oil,U.S. challenges J.M. Smucker's purchase of Conagra’s Wesson oil brand
CMG,BRIEF-Chipotle Grants CEO Brian Niccol Inducement Awards
CMS,BRIEF-CMS Energy Corp Files for Offering of $200 mln 5.625% Junior Subordinated Notes Due 2078
COP,BRIEF-ConocoPhillips CEO Sees E&P Industry Trying To Attract Back Value Investors
CTL,BRIEF-CenturyLink CEO Glen Post To Retire In May Effective On Date Of Centurylink's 2018 Annual Shareholders' Meeting
CVS,Investors pile into CVS $40 billion M&A bond,"TREASURIES-Bonds steady as trade war, North Korea fears ease"
CVX,Chevron expects LNG supply shortage by 2025,"Chevron backs 2018 production rise, eyes share buybacks",Chevron expects LNG supply shortage by 2025,BRIEF-Chevron Sees 2018 Cash Generation Of About $14 Bln,Chevron says looking to resume share buybacks,BRIEF-Chevron Affirms Cash Flow Growth And Capital Discipline
DIS,"Lawsuit seeks White House, Justice Department records on Fox-Disney deal","UPDATE 1-Lawsuit seeks White House, Justice Dept records on Fox-Disney deal"
DOW,Argentina approves GMO varieties for corn and soybeans
DUK,BRIEF-Duke Energy Announces Public Offering Of Common Stock With Forward Component
ETFC,"BRIEF-E Trade Financial Corp Reports Preliminary Darts Of 330,000 For February 2018, 5 Pct Up From January"
FB,"BlackBerry files lawsuit against Facebook, WhatsApp and Instagram",BRIEF-BlackBerry files patent infringement lawsuit against Facebook -- online court records,France may probe Google and Facebook over online ad dominance
FCX,BRIEF-Fibrocell Announces FDA Allowance Of Investigational New Drug Application For FCX-013,Indonesia president wants to wrap up Freeport talks by end-April
FE,BRIEF-FirstEnergy Files Prospectus Related To Offering Of Up To 30.1 Mln Shares Of Common Stock,BRIEF-FirstEnergy Files For Mixed Shelf With The U.S. SEC,BRIEF-‍Firstenergy Says Met-ED Line Crews And Other Personnel Continue To Make Repairs Following Storm​
FTR,BRIEF-Frontier Communications Announces Cash Tender Offers
GIS,"BRIEF-General Mills Helps Transition 34,000 Acres into Organic Farmland"
GRMN,BRIEF-Garmin Grows Connext Wireless Cockpit Connectivity Portfolio
HON,BRIEF-Honeywell Partners With Global Logistics Provider Kuehne + Nagel
HRB,BRIEF-H&R Block Qtrly ‍Consolidated Loss Per Share $1.18
IP,Smurfit Kappa rejects International Paper's $10 billion bid,BRIEF-International Paper Confirms It Has Submitted Proposal To Acquire Smurfit Kappa,Smurfit Kappa rejects unsolicited International Paper approach
JPM,BRIEF-Duke Energy Announces Public Offering Of Common Stock With Forward Component
JWN,Nordstrom rejects initial take-private offer by family group
LH,BRIEF-Labcorp Says On Track To Deliver $150 Mln In Cumulative New Revenue From Covance Acquisition Through 2018
LRCX,BRIEF-Lam Research Corporation Announces Capital Return Program
MA,BRIEF-XOX Clarifies On Partnership With Mastercard
MAR,BRIEF-Marriott International Appoints Publicis Groupe's Sapientrazorfish And Spark Foundry For Global Media Duties,BRIEF-Marriott International To Move Entire Paid Media Business To Publicis‍ - Axios​
MCD,"McDonald's flips to fresh beef in 3,500 U.S. restaurants"
MDLZ,BRIEF-‍Mondelez International Files For Offering Of C$600 Million Of 3.250% Notes Due 2025
MMC,BRIEF-Oliver Wyman Acquires Design Thinking Consultancy 8works
MRO,"BRIEF-Marathon Oil Says Doug Foshee, Lisa Hyland Elected To Board"
NWS,"BRIEF-News Corp, Telstra Sign Australia Deal"
NWSA,"BRIEF-News Corp, Telstra Sign Australia Deal"
PXD,U.S. metals tariff would hurt future returns: shale company CEO
QCOM,Qualcomm in talks to settle patent dispute with Huawei: WSJ,BRIEF-Qualcomm in talks to settle patent-royalty dispute with Huawei Technologies- WSJ,Exclusive: Secretive U.S. security panel discussing Broadcom's Qualcomm bid - sources,U.S. panel says concerns over Broadcom deal warrant full investigation -Treasury,RPT-Qualcomm takeover battle intervention shows U.S. security panel's expanding reach,U.S. security panel deals major blow to Broadcom's bid for Qualcomm,Qualcomm takeover battle intervention shows U.S. security panel's expanding reach,BRIEF-Qualcomm To Adjourn Annual Meeting Of Stockholders To April 5,Qualcomm takeover battle intervention shows U.S. security panel's expanding reach
RIG,Mexican offshore Trion project partners weigh floating oil facility,Offshore Drillers: Results Of The Earnings Season
ROST,BRIEF-Ross Stores Q4 Earnings Per Share $1.19,BRIEF-Ross Stores Q4 Earnings Per Share $1.19
SJM,J.M. Smucker drops bid to buy Conagra's Wesson Oil after U.S. objects,"BRIEF-Conagra Brands, J.M. Smucker Terminate Deal For Wesson Oil Business Sale",U.S. challenges J.M. Smucker's purchase of Conagra’s Wesson oil brand
SLB,CERAWEEK-Schlumberger CEO sees more investment needed to meet oil demand
SPGI,BRIEF-S&P Global To Acquire Kensho,S&P Global to buy AI firm Kensho for $550 million
STT,"MOVES-State Street, Aon, HSBC, Moelis, Willis Towers Watson",BRIEF-State Street - ‍Developed & Begun Licensing Suite Of Rules-Based Investment Strategies,MOVES-State Street Corp appoints new country head for China
T,BRIEF-AT&T Collaborates With Aira To Develop AI Powered Prescription Medication Reader
TDG,BRIEF-Tiger Global Reports 5.3 Pct Passive Stake In Transdigm Group
TGT,BRIEF-Target To Raise Capital Investment To Over $3 Billion In 2018 - Conf call,Target sees margins stabilizing in year ahead as profit disappoints,"Target sales jump, profit misses in holiday quarter",BRIEF-Target Reports Q4 Adjusted EPS Of $1.37 Excluding Items
TXT,BRIEF-Textron Says CEO Scott Donnelly's FY 2017 Total Compensation Was $14.8 Mln
UNH,BRIEF-UnitedHealthcare Launches Expansion of Direct-to-Consumer Pharmacy Discounts to Millions of Americans
UPS,BRIEF-UPS Names Jim Barber Chief Operating Officer
URBN,BRIEF-Urban Outfitters Reports Q4 Adjusted Earnings Per Share $0.69
WFC,BRIEF-Wells Fargo unit sues LJM to recoup losses tied to market volatility,RPT-Investor group says Wells Fargo to publish report on sales scandal,Investor group says Wells Fargo to publish report on sales scandal
WLTW,MOVES-Willis Towers Watson names new head of Bermuda captive business
XOM,"Exxon Mobil interested in working in Algeria, Sonatrach CEO says","UPDATE 1-Exxon Mobil interested in working in Algeria, Sonatrach CEO says","BRIEF-ExxonMobil And Synthetic Genomics Algae Biofuels Program Targets 10,000 Barrels Per Day by 2025"
