AAL,American Airlines mechanic accused of sabotage will remain behind bars
AAPL,Wall Street mixed as Microsoft climbs and Apple dips,"US STOCKS SNAPSHOT-Wall Street ends mixed as Microsoft, Apple offset","Huawei talks up own apps with Mate 30 challenge to Apple, Samsung",Huawei seeks to upstage Apple with Mate 30 smartphone launch
AMZN,Electric vehicle startup Rivian gets a jolt from big Amazon.com van order,Reuters collaborates with Amazon to help Alexa answer even more questions,Drop in online shopping knocks UK retail sales in August
BA,CORRECTED-Aviation watchdog may ask Boeing to set up 737 MAX simulators in India,Ryanair expects to be flying Boeing 737 MAX by February-March 2020
C,MOVES-Citigroup appoints Jason Rekate as global head of corporate banking,Citi worker's SOX claim barred from court after missed deadline- 2nd Circuit,MOVES-Citigroup hires Summerfield to run asset management investment banking
CMCSA,Digital sports platform DAZN reaches distribution deal with Comcast,Comcast reaches distribution deal with digital sports platform DAZN
CME,French regulator urges UK to avoid Brexit clash in derivatives,UPDATE 1-U.S. derivatives watchdog calls on EU for more trust
FB,"Trump, Facebook CEO Zuckerberg had 'good, constructive' meeting: Facebook","Trump, Facebook CEO Zuckerberg had 'good, constructive' meeting -Facebook","Facebook unveils new Portal video chat, TV streaming devices",Facebook CEO Zuckerberg dines with senators in DC
FDX,"Alphabet unit to make drone deliveries for Walgreens, FedEx in the U.S."
GE,Activist investor Peltz says GE CEO Culp is doing a good job
GM,UAW says some progress has been made in GM talks
GOOG,"Alphabet unit to make drone deliveries for Walgreens, FedEx in the U.S."
GOOGL,"Alphabet unit to make drone deliveries for Walgreens, FedEx in the U.S."
KO,Coca-Cola HBC buys Italian premium mineral water maker Lurisia
LUV,Southwest passengers get no damages for flights canceled by de-icer shortage: U.S. judge
MS,Turkish banks tap Morgan Stanley for Turk Telekom stake sale,Morgan Stanley hires chemicals banking veteran Jean de Miramon
MSFT,Microsoft nominates GSK CEO Walmsley to board,"Shares edge up after Fed rate cut, oil prices gain",Microsoft approves $40 billion share repurchase program,"US STOCKS SNAPSHOT-Wall Street ends mixed as Microsoft, Apple offset","GLOBAL MARKETS-Shares rise after Fed rate cut, oil prices gain",India's Eros Now ties up with Microsoft's Azure platform,"US STOCKS-Microsoft, health shares boost Wall St; S&P 500 eyes record high","GLOBAL MARKETS-Shares rise after Fed cut, oil prices jump",US STOCKS-Microsoft drives S&P 500 near record high,"US STOCKS SNAPSHOT-Microsoft, energy stocks lift Wall Street at open"
OXY,Occidental Petroleum recommends lowering threshold for special meetings
PCG,Wildfire victims in PG&E bankruptcy to present $24 bln reorganization plan,Wildfire victims' committee pans PG&E's $11 bln deal with insurers
PG,Trian and P&G highlight activist-corporate collaboration after 'fog of war'
RIG,Pacific Drilling - Ultra High-Risk Ultra-Deepwater Pure Play Hits The Bargain Bin,Petrobras Fails To Sell Vitoria 10000 - That's Good News
VLO,"Valero Port Arthur, Texas refinery cuts production due to storm: sources"
WBA,"Alphabet unit to make drone deliveries for Walgreens, FedEx in the U.S."
XLNX,Xilinx CFO Lorenzo Flores to step down
XOM,"Exxon shutting Beaumont, Texas refinery due to flooding: sources","India's Modi to meet BP, Exxon executives to discuss investment opportunities"
ZTS,Biotech is going to the dogs - and big profits await,Factbox: Animal health sector aims to emulate Zoetis biotech leap
