C,Citi expects privatization to bolster revenue in Brazil,Citi to double Brazil commercial bank unit's assets by 2020,Citi in talks to buy Canary Wharf office building: source
CB,"Retailers Ross Stores, TJX Companies Expected To Lead Dividend Increases In Second Half Of February"
FB,"Facebook broke rules, should be regulated: UK lawmakers",Facebook says it is 'open to meaningful regulation',Facebook needs independent ethical oversight - UK lawmakers
MAR,EU mergers and takeovers (Feb 18)
NAVI,Navient rejects $3.2 billion takeover bid from Canyon Capital and Platinum Equity
RIG,BRIEF-Transocean Ltd. Reports Q4 Adjusted Loss Per Share $0.34,BRIEF-Transocean Announces Drilling Automation Of Six Floaters
RTN,Raytheon wins $1.5 billion UAE air force contract
SLB,Qatar Petroleum signs initial deals to boost local energy industry
