AAL,American Airlines follows Southwest in pulling 737 MAX until early March
BA,"Southwest and American pull 737 MAX until early March, nearly a year after grounding"
DIS,S&P 500 posts fifth week of gains as Wall St. hits records
LUV,American Airlines follows Southwest in pulling 737 MAX until early March,"Southwest and American pull 737 MAX until early March, nearly a year after grounding"
OXY,Activist investor Icahn sells nearly a third of his Occidental Petroleum stake
UHS,IN BRIEF: Universal Health Services to settle DOJ hospital probe in Georgia
