AAPL,Apple says Spotify wants benefits of a free app without being free,U.S. judge rules Qualcomm owes Apple nearly $1 billion rebate payment
BA,UAL says business could be hurt if 737 MAX groundings extend into summer,Ethiopia crash may test Boeing's success in defeating U.S. lawsuits: legal experts,Boeing says 737 MAX software upgrade will be deployed in coming weeks,UPDATE 1-Boeing says 737 MAX software upgrade will be deployed in coming weeks,Boeing says 737 MAX software upgrade will be deployed in coming weeks,SunExpress sticks to Boeing 737 MAX orders despite crashes - newspaper,RPT-Ethiopia crash may test Boeing's success in defeating U.S. lawsuits -legal experts,Boeing 737 MAX jets could be grounded for weeks as black box probe to start on Ethiopia crash
CB,Dividend Champion Spotlight: Chubb Limited
CME,Cboe puts the brakes on bitcoin futures
CVX,S.Africa's Competition Tribunal approves Glencore's bid for Chevron subsidiary,"BRIEF-SA's Competition Tribunal Approves Glencore, Chevron Merger, With Conditions"
D,Dominion to keep Connecticut Millstone nuclear plant in service,Dominion to keep Connecticut Millstone nuclear plant in service
ED,Con Edison faces potential fine over breaches of safety rules,"No new natural gas hookups in New York's Westchester County, Con Ed says",NY's Con Ed sticking with moratorium on new natural gas service in Westchester
FB,Breakingviews - Facebook departure is a wake-up call for investors,"Facebook shares drop as executives quit, Christchurch live-stream shooting stirs outrage",Facebook readies AI tech to combat 'revenge porn',Facebook takes steps against 'revenge porn',Facebook product chief Cox to exit as focus shifts to messaging
GS,"Oil demand concerns overdone, Brent to rise above $70/bbl: Goldman"
MA,"U.S. considers sanctions to restrict Visa, Mastercard in Venezuela: official"
MAR,Marriott evaluates investor Jonathan Litt's nomination for board seat,Marriott evaluates investor Jonathan Litt's nomination for board seat
NUE,Nucor sees first quarter profit below estimates,Nucor sees first quarter profit below estimates
QCOM,U.S. judge rules Qualcomm owes Apple nearly $1 billion rebate payment
RIG,Saipem joint venture push with U.S. drillers draws a blank: sources,Offshore Drilling: Semi-Sub Fundamentals March 2019 Edition
STZ,Corona maker Constellation nearing deal to sell some wine brands - CNBC,Corona maker Constellation nearing deal to sell some wine brands - CNBC
UAL,UAL says business could be hurt if 737 MAX groundings extend into summer,CORRECTED-UAL says business could be hurt if 737 MAX groundings extend into summer
V,"U.S. considers sanctions to restrict Visa, Mastercard in Venezuela: official"
