AAPL,"Case to Watch: Apple, Cisco defend Federal Circuit’s summary-affirmance rule in fight over VOIP patents",Apple starts selling locally assembled iPhone XR in India,Wall Street Week Ahead: Tech haves and have-nots face third-quarter tests
BA,Boeing may face billions more in losses as MAX crisis deepens - analysts,"Boeing CEO says continuing to make ""steady progress"" on lifting 737 MAX ban -internal email",Boeing may face billions more in losses as MAX crisis deepens - analysts,US STOCKS-Futures up on hopes of progress in trade war; Boeing shares slip,"Boeing expresses regret over ex-pilot's 737 MAX messages, faults simulator"
CSCO,"Case to Watch: Apple, Cisco defend Federal Circuit’s summary-affirmance rule in fight over VOIP patents"
CVX,U.S. allows Chevron to drill for oil in Venezuela for three more months
EQT,"Althea Group draws interest from EQT, BC Partners as bidding opens: sources"
FB,Facebook suspends Russian Instagram accounts targeting U.S. voters,Facebook announces new steps to clamp down on misinformation ahead of 2020 election,"Zuckerberg defends Facebook's approach to free speech, draws line on China"
GS,Goldman Sachs lowers 'no deal' Brexit probability to 5% from 10%
HAL,"Halliburton vows more cost cuts as shale demand dwindles, shares rise",Halliburton profit falls 32% on weak N. America drilling
MSFT,SAP teams up on cloud sales with Microsoft,EU data watchdog raises concerns over Microsoft contracts,EU data watchdog raises concerns over Microsoft contracts with EU institutions,SAP in three-year cloud partnership with Microsoft,Wall Street Week Ahead: Tech haves and have-nots face third-quarter tests
PCG,San Jose to propose turning PG&E into giant customer-owned utility - WSJ,San Jose to propose turning PG&E into giant customer-owned utility - WSJ,"PG&E plans more power cutoffs, warns of severe weather this week"
PSX,"Odds of strike rise as Bayway workers, Phillips 66 hit impasse"
RIG,Noble Trying To Cope With Scarcity,Transocean Is Feeling The Pinch
TXT,"Textron expands parts business capabilities, eyes aftermarket services"
UPS,Drugstore drones: UPS will fly CVS prescriptions to U.S. customers,REFILE-Drugstore drones: UPS will fly CVS prescriptions to customers
VLO,"Valero shuts small crude unit at Port Arthur, Texas refinery: sources"
VRTX,"Vertex prices cystic fibrosis combo treatment at $311,000-per-year",FDA approves Vertex Pharma's combo treatment for cystic fibrosis
