AAPL,"Apple, luxury brands drop prices in China on VAT cut","Apple, luxury brands drop China prices as VAT cuts come into effect"
AGN,BRIEF-Allergan And Molecular Partners Announce Topline Safety Results From Maple Study Of Abicipar Pegol
BA,U.S. Senate panel reviewing whistleblower claims on aviation safety: panel chair,Brazil's Gol will not cancel Boeing 737 MAX orders: newspaper,Air Canada delays launch of seasonal routes due to Boeing MAX grounding,U.S. Air Force again halts deliveries of Boeing KC-46 tanker aircraft,Daimler CEO: Boeing safety debate highlights challenge for autonomous tech,Daimler CEO: Boeing safety debate highlights challenge for autonomous tech,Boeing to submit 737 MAX software upgrade 'in the coming weeks',Singapore Airlines grounds two 787-10s citing Rolls-Royce engine problem,Singapore Airlines grounds two 787-10s after inspections of Rolls-Royce Trent 1000 TEN engines
BBY,Care.com slumps after Best Buy suspends relationship,Best Buy suspends relationship with Care.com
BLK,BlackRock's Larry Fink overhauls leadership ranks in key business units
C,Britain sells 4.9 bln stg of former Northern Rock mortgages to Citi,"Citibank defeats SDNY lawsuit over garnishment exemptions, fees"
CB,BRIEF-Chubb Ltd Says CEO's FY 2018 Total Compensation Was $20.4 Mln
CMCSA,Judge wants more details on Comcast's $7.5 mln settlement of OT claims
CME,"Bitcoin jumps 20 percent, mystery order seen as catalyst"
CVX,Chevron takeover of Petrobras Pasadena refinery stalls: sources
DAL,Delta's upbeat first-quarter profit estimate lifts shares,Delta Air Lines expects first-quarter profit above Wall Street estimates
FB,WhatsApp launches fact-check service to fight fake news during India polls
GM,GM U.S. new vehicle sales fall 7 percent in first quarter
HOG,Harley-Davidson workers in Wisconsin reject new labor contract,Harley Davidson to extend current labor contract through April 14 -union
INTC,Qualcomm finance chief departs for rival Intel,"Qualcomm finance chief to depart, likely for rival Intel"
MSFT,"Microsoft, BMW launch industrial cloud technology partnership",Microsoft and BMW launch open manufacturing platform
NTRS,MOVES-Northern Trust Names Melíosa O'Caoimh as head of Ireland business
PCG,U.S. judge orders PG&E to hold dividends to pay for efforts to reduce wildfire risks,PG&E to name TVA's Bill Johnson as CEO -source,PG&E faces new probation terms aimed at cutting wildfire risk
QCOM,Qualcomm finance chief departs for rival Intel,"Qualcomm finance chief to depart, likely for rival Intel"
RIG,5%+ Dividend Yield Portfolio: Improvements Years In The Making (Mar 2019 Review)
WBA,"US STOCKS SNAPSHOT-Wall St treads water after rally, Walgreens slumps","Walgreens cuts 2019 profit forecast, hit by lower drug prices",Walgreens cuts 2019 profit growth forecast
WYNN,Massachusetts says Wynn Resorts executives concealed sexual misconduct accusations involving Steve Wynn,Massachusetts: Wynn Resorts execs concealed sex claims involving Wynn
XOM,Exxon offers first glimpse of results from expanded trading unit,U.S. regulator rules out Exxon shareholder vote on climate resolution,Exclusive: Exxon weighs sale of Nigerian oil and gas fields for up to $3 billion,Exxon makes final investment decision on Singapore complex expansion
