AAPL,Apple wins dismissal of Texas lawyer's FaceTime eavesdropping lawsuit
AMGN,Lilly's new migraine drug pulls ahead of Amgen in fierce battle for new prescriptions,Lilly's new migraine drug pulls ahead of Amgen in fierce battle for new prescriptions
AMZN,Amazon holds talks with workers in Poland as strike threatened
BLK,Liquidity at Italy's Carige steady after Blackrock pulls out of rescue - sources
C,Citigroup names investor relations chief as consumer bank CFO
CVX,Occidental's victory over Chevron for Anadarko,TIMELINE-Occidental's victory over Chevron for Anadarko,From Paris to Omaha: How Occidental CEO out-maneuvered Chevron in Anadarko bid
EXPE,"U.S. state AGs looking into Expedia Group, hotel practices in antitrust probe"
FB,"Facebook rejects co-founder call for breakup, senator urges U.S. antitrust probe",Facebook's Zuckerberg hails French hate speech plan as EU model,"Uber starts trading at $42 a share, 6.7% below IPO price","Turkish watchdog says it fines Facebook $271,000 for data breach",France seeks handle on Facebook algos to help combat hate speech
GE,GE's rising bonds offer another endorsement of CEO Culp
GS,Goldman Sachs nears deal to buy United Capital,Goldman Sachs nears deal to buy United Capital -WSJ
JNJ,Danish medical equipment maker Ambu sinks after departure of CEO
LMT,"After U.S. complaint, Canada to soften rules for jet competition to allow Lockheed Martin bid: source"
MAR,"Marriott profit beats on lower tax bill, higher room prices",Marriott quarterly profit beats on higher room rates,"U.S. state AGs looking into Expedia Group, hotel practices in antitrust probe"
OXY,"'We are the rightful owners' of Anadarko, Occidental CEO tells shareholders",Occidental chief faces shareholders on cusp of takeover victory,From Paris to Omaha: How Occidental CEO out-maneuvered Chevron in Anadarko bid
RIG,The Daily Drilling Report's Oilfield Almanac And Gazette: April 2019
SBUX,Bodum sues Starbucks for product disparagement over French press recall
WMT,"Walmart Brasil to ditch e-commerce, focus on brick and mortar",Asda to rely on Walmart largesse after Sainsbury's dream expires
