AAPL,Apple briefly regains title as most valuable U.S. company,Apple briefly regains title as most valuable U.S. company
ABT,Abbott's Alere to resolve securities fraud case for $20 million
AGN,FDA approves cheaper Botox rival to treat frown lines
AMZN,Apple briefly regains title as most valuable U.S. company,Apple briefly regains title as most valuable U.S. company
AN,"Four senior executives leave AutoNation amid restructuring, bleak outlook"
CME,U.S. crypto exchange Kraken buys index provider Crypto Facilities,METALS-Copper eases for 2nd session on China growth concerns,METALS-Copper eases for 2nd session on China growth concerns,METALS-Copper eases for 2nd session on China growth concerns
CMG,Some U.S. funds waiting for earnings to buy shares of surging Chipotle
DNB,DNB maintains support for Nasdaq's bid for Oslo Bors VPS,DNB maintains support for Nasdaq's bid for Oslo Bors VPS
FB,Breakingviews - Google and Facebook are begging for a watchdog
GE,GE to spin off transportation unit on Feb. 14
GILD,"Gilead fourth-quarter profit misses Wall Street estimate, shares fall","Gilead fourth-quarter profit misses Wall Street estimate, shares fall"
GM,"GM cutting 4,000 workers in latest round of restructuring"
GOOG,"UPDATE 2-Alphabet beats Wall St estimates, but spending worries investors","Alphabet fourth-quarter revenue, profit beat estimates",US STOCKS-Wall Street set to open flat with Alphabet results on tap,CORRECTED-US STOCKS-Futures eke out gains ahead of Alphabet results
GOOGL,"UPDATE 2-Alphabet beats Wall St estimates, but spending worries investors","Alphabet fourth-quarter revenue, profit beat estimates",US STOCKS-Wall Street set to open flat with Alphabet results on tap,CORRECTED-US STOCKS-Futures eke out gains ahead of Alphabet results
GS,Goldman Sachs invests in HSBC-backed fintech app Bud
MSFT,Apple briefly regains title as most valuable U.S. company,Apple briefly regains title as most valuable U.S. company
NDAQ,Euronext may sweeten offer for Oslo Bors as Nasdaq makes rival bid
RIG,5%+ Dividend Yield Portfolio: Profiting Handsomely From Volatility (Jan 2019 Review)
SLB,Schlumberger scraps bid for stake in Russia's Eurasia Drilling,Schlumberger drops its bid for Russia's Eurasia Drilling - RIA
XOM,"U.S., Qatar energy ministers to announce Qatari investment in U.S.: Energy Department"
