ABT,"Abbott misses revenue estimates, sees lackluster first-quarter profit",Abbott Labs says M&A not a high priority now,Abbott Labs says M&A not a high priority now,Abbott Lab's fourth-quarter revenue rises 2.3 pct
AKAM,UPDATE 1-EU mergers and takeovers (Jan 23),EU mergers and takeovers (Jan 23)
AMZN,Amazon spends company record on U.S. lobbying in 2018: filing,Amazon spends company record on U.S. lobbying in 2018 -filing
BA,"CORRECTED, OFFICIAL -Boeing's flying car lifts off in race to revolutionize urban travel"
BAC,Bank of America names new investment bank operating chief: memo
BLK,BlackRock's Turnill sees greater role for bonds as economic cycle matures
C,"U.S. bank Citi to shrink Russia branch network, but expects to do more business"
CMCSA,Comcast tops profit forecasts as broadband business grows,Comcast revenue beats on lower-than-expected video losses
FB,Facebook takes steps to prevent removed pages from duplicating content,"Facebook's Sandberg says Zuckerberg should remain CEO, chairman","Google, Facebook spend big on U.S. lobbying amid policy battles"
GE,General Electric to cut close to 470 jobs in France: unions
GS,MOVES-Goldman appoints new APAC TMT group co-head
IBM,US STOCKS SNAPSHOT-Strong earnings boost Dow at the open,"Cloud, services fuel IBM's profit beat, robust outlook; shares jump"
JNJ,Johnson & Johnson eyeing surgical robotics firm Auris Health: Bloomberg,J&J eyeing surgical robotics firm Auris Health -Bbg,"J&J forecasts disappointing 2019 sales, defends talc safety","J&J, U.S. states settle hip implant claims for $120 million"
JPM,JPMorgan's private bank expands business in Mexico: regional CEO,"Dimon says U.S., China could get 'enough done' to extend deal deadline: CNBC"
KMB,"Kimberly-Clark misses profit estimates, shares fall",Kimberly-Clark quarterly sales beat estimates
NFLX,Hulu cuts price of most popular plan by 25 percent
PCG,PG&E expects capital spending of about $6.6 billion in 2019,PG&E expects to spend about $6.6 billion in 2019
PG,"Procter & Gamble bets on demand for high-end fabric, skin-care products",US STOCKS SNAPSHOT-Strong earnings boost Dow at the open,Procter & Gamble second-quarter sales beat estimates
PLD,Norway wealth fund bought stakes in U.S. logistics properties
QCOM,Kerrisdale says Qualcomm's stock could shrink by half: report
RIG,BRIEF-Transocean Ltd. Announces Pricing Of U.S. $550 Mln Of Secured Notes Due 2027,BRIEF-Transocean Ltd Announces Proposed Private Offering Of U.S. $550 Million Of Secured Notes Due 2027,BRIEF-Transocean Ltd Announces Early Results Of Cash Tender Offers
TXN,Texas Instruments' quarterly revenue dips 1 pct
UTX,United Tech profit beats forecasts on aerospace jump,US STOCKS SNAPSHOT-Strong earnings boost Dow at the open,United Tech 4th-qtr profit rises 73 percent
VRTX,Vertex Pharma boots out COO for 'personal behavior' violations,Vertex Pharma terminates interim CFO's employment for code violations
VZ,Verizon cuts 7 percent of jobs in media unit
WBA,Walgreens pays $269.2 million to settle U.S. civil fraud lawsuits
XOM,BRIEF-ExxonMobil And Renewable Energy Group Partner With Clariant To Advance Cellulosic Biofuel Research
