AMZN,Amazon's second headquarters clears blocks in Virginia funding vote
BA,"Boeing says finalizing software upgrade, revising pilot training for 737 Max","Boeing says finalizing software upgrade, revising pilot training for 737 Max",Boeing's safety analysis of 737 MAX flight control had crucial flaws: Seattle Times,Factbox: What we know about Boeing 737 MAX crash and what comes next
BLK,MOVES-PJT Camberview hires BlackRock executive -sources
PCG,PG&E close to reshaping leadership with investor backing: WSJ
PFG,Principal Financial close to Wells Fargo retirement unit acquisition-sources
WFC,Principal Financial close to Wells Fargo retirement unit acquisition-sources
