BIIB,"Novartis gene therapy would be cost effective up to $900,000: U.S. group"
CVX,N.Y. high court allows asbestos plaintiff second shot at Chevron despite prior settlement
FB,NY governor orders probe into Facebook access to data from other apps
KHC,"Falling stocks, Kraft Heinz trigger huge Berkshire loss","Kraft Heinz shares fall 28 percent after writedown, dividend cut"
LUV,"Southwest CEO says mechanics deserve new contract, but company wants 'flexibility'","UPDATE 1-Southwest CEO says mechanics deserve new contract, but company wants 'flexibility'"
MSFT,Microsoft workers demand it drop $480 million U.S. Army contract
PCG,PG&E's unsecured creditors want power contracts kept in bankruptcy court
