AAPL,Apple's Cook to China: keep opening for sake of global economy
AGN,RPT-UPDATE 2-Allergan promises independent board chair in next leadership change
BA,U.S. airlines visit Boeing as FAA awaits 737 MAX upgrades,"U.S. airlines prepare for 737 MAX tests, Southwest parks jets near desert",U.S. airlines sending teams to review Boeing 737 MAX upgrade this weekend,UPDATE 2-U.S. airlines sending teams to review Boeing 737 MAX upgrade this weekend
JPM,Turkish watchdogs to probe JP Morgan after lira plunge,Turkey's capital markets board launches inspection over JP Morgan claims -NTV,"Turkish watchdog to investigate JP Morgan, other banks -Anadolu"
PM,Philip Morris says Canadian unit RBH granted creditor protection,Philip Morris says Canadian unit RBH granted creditor protection
RIG,Stocks To Watch: Apple Makes Its Video-Streaming Move
T,"AT&T, Viacom continue contract negotiations past deadline"
