AAL,American Airlines 'confident' of Boeing 737 MAX flying this year: executive
AMZN,CVS fights ex-exec's appellate bid to join Amazon's PillPack
BA,Exclusive: Boeing CEO eyes major aircraft order under any U.S.-China trade deal,Russia's Rostec unit ready for out-of-court deal with Boeing on 737 MAX order,Russia's Rostec confirms unit filed lawsuit to cancel Boeing 737 MAX order
BLK,BlackRock takes aim at CEOs serving on other companies' boards
COP,ConocoPhillips sells Oct-loading Bayu Undan condensate at discount - sources
CVS,CVS fights ex-exec's appellate bid to join Amazon's PillPack
FB,Facebook expands 'Local Alert' tool in bid to help in emergencies,Thiel's Founders Fund sells remaining Facebook shares
GOOG,UPDATE 2-U.S. charges ex-Alphabet engineer with stealing self-driving car secrets,U.S. charges Levandowski with stealing Alphabet trade secrets
GOOGL,UPDATE 2-U.S. charges ex-Alphabet engineer with stealing self-driving car secrets,U.S. charges Levandowski with stealing Alphabet trade secrets
JNJ,"US STOCKS-Wall Street dips as financials weigh, trade hopes dim","US STOCKS-Wall Street treads water as financials fall, trade hopes flicker",J&J liable for $572 million in Oklahoma opioid epidemic trial; shares rise
JPM,JPMorgan considers sale of $1 billion AARP credit-card portfolio: Bloomberg
MA,"BRIEF-Cembra Money Bank AG, FNAC extend FNAC Mastercard co-operation agreement to 2024"
MCD,"IN BRIEF: McDonald's, other franchises want exemption to Calif. worker classification bill"
MNK,Drugmaker Mallinckrodt's shares fall 12% after unfavorable patent ruling
MO,Philip Morris and Altria in merger talks as Marlboro fades and e-cigs light up,Philip Morris in talks to merge with Altria
MSFT,Dutch regulator sees potential privacy breach in Microsoft Windows,Dutch regulator sees potential privacy breach in Microsoft Windows
PM,Philip Morris and Altria in merger talks as Marlboro fades and e-cigs light up,Deals of the day-Mergers and acquisitions,Philip Morris in talks to merge with Altria
QCOM,Qualcomm targets Wi-Fi market in push to expand beyond phones
RIG,Offshore Drilling: Floater Fundamentals - August 2019 Edition
SJM,Weak dog food sales hit Smucker results; shares tumble,"J. M. Smucker misses quarterly sales estimates, cuts full-year forecast"
SRE,Shares in Mexico's IEnova rise almost 7% after pipeline deal
STZ,Constellation expects $54.8 million in quarterly losses from Canopy investment,CORRECTED-Constellation expects $54.8 mln in quarterly losses from Canopy investment (Aug.26)
