AAPL,"UPDATE 5-Apple News+, at $10 a month, could deliver more content than multiple subscriptions","S&P 500 slips with Apple, lingering fears on global growth",Apple to launch a new credit card with Goldman. Are the perks worth it?,UPDATE 2-Apple to launch a new credit card with Goldman. Are the perks worth it?,REFILE-UPDATE 1-Apple partners with Goldman to add a credit card to Wallet,"U.S. Treasury yields hit lowest since late 2017, global stocks fall",Apple TV+ joins crowded market for streaming options,Apple TV+ joins crowded market for streaming options,"Factbox: Apple launches TV app, streaming and gaming service","US STOCKS-Wall St falls with Apple, lingering global growth fears",Apple launches game subscription service 'Apple Arcade',UPDATE 1-Apple launches game subscription service 'Apple Arcade',Apple launches credit card with Goldman Sachs,Apple News+ is $10 per month. Is it time to dump your New Yorker subscription?,Apple launches game subscription service,Apple invites Hollywood to Silicon Valley in TV push
AGN,Hedge fund Appaloosa unimpressed by Allergan board promises,Allergan defeats RICO lawsuit over Warner Chilcott drug marketing,Hedge fund Appaloosa unimpressed by Allergan board promises
BA,UPDATE 2-Boeing fix will prevent repeated activation of anti-stall system -sources,UPDATE 1-U.S. panel to review how airplanes certified after Boeing 737 crashes,Boeing fix will prevent repeated activation of anti-stall system -sources,U.S. panel to review how airplanes certified after Boeing 737 crashes,"Norwegian to lease planes, postpone sales after grounding of Boeing MAX","UPDATE 1-Norwegian to lease planes, postpone sales after grounding of Boeing MAX",Grounding of Boeing jets contributed to Germania failure - liquidator,Ethiopian Airlines commits to Boeing ties despite flight 302 crash questions,UPDATE 2-Ethiopian Airlines commits to Boeing ties despite flight 302 crash questions,Ethiopian Airlines has no immediate plans to attend Boeing's U.S. meeting,Ethiopian Airlines has no immediate plans to attend Boeing's U.S. meeting,"UPDATE 1-Boeing invites pilots, regulators to brief about plan to support 737 MAX's return"
BIIB,Biogen announces $5 billion buyback days after shelving Alzheimer's trials
BLK,"UPDATE 1-BlackRock, Varde set to submit bids for Italy's Carige -sources","BlackRock, Varde set to submit bids for Italy's Carige: sources",BlackRock makes two new investment stewardship hires: sources,MOVES-BlackRock makes two new investment stewardship hires- sources
EBAY,Scout24 expresses interest in eBay's classifieds business,Scout24 expresses interest in EBay's classifieds business
GS,Apple to launch a new credit card with Goldman. Are the perks worth it?,UPDATE 2-Apple to launch a new credit card with Goldman. Are the perks worth it?,REFILE-UPDATE 1-Apple partners with Goldman to add a credit card to Wallet,Apple launches credit card with Goldman Sachs
JNJ,"Oklahoma top court clears way for Purdue, J&J, Teva to face opioid trial","Bayer, J&J settle U.S. Xarelto litigation for $775 million","Bayer, J&J settle U.S. Xarelto litigation for $775 mln"
JPM,"JPMorgan awards research grants, deepening its AI push","UAE's Shuaa Capital, ADFG mandate banks on merger plan - ADFG"
KMI,"Kinder Morgan quits Enbridge, Oiltanking crude export venture"
MCD,McDonald's to buy Israel's Dynamic Yield
MMM,"MDL Watch: Consolidation sought in 3M army earplug, cement siding cases"
MS,Oil prices slide on concerns of sharp economic slowdown
NEM,Newmont's special dividend wins top investors over to Goldcorp deal,Newmont seeks to assuage investors with special dividend if Goldcorp deal succeeds
NFLX,"Breakingviews - Apple stretches to take on Netflix, Amex, Disney"
NKE,Nike fined $14 million for blocking cross-border sales of soccer merchandise,Nike fines $14 mln for blocking cross-border sales of soccer merchandise
PCG,"Bankrupt PG&E, victims of 2015 wildfire fight over fire prevention funding"
RTN,"BRIEF-Raytheon, France's Eurosam Submit Offers For Swiss Air Defence"
SLB,Schlumberger to stop taking new field-management projects: CEO,Schlumberger to stop taking new field-management projects -CEO
T,"Viacom, AT&T renew contract, avoid DirecTV blackout",Viacom renews contract with AT&T to continue airing channels on DirecTV
TMO,Thermo Fisher to acquire Brammer Bio in $1.7 billion deal,Thermo Fisher to acquire Brammer Bio in $1.7 bln deal
TSN,Tyson recalls tons of chicken strips for possible metal contamination
XOM,Exxon says high-sulfur fuel oil demand to decline 25 percent,Exxon sees high sulphur fuel oil demand to decline 25 percent
