AMZN,"Court fight sheds light on Amazon, Berkshire, JPMorgan health venture"
BA,Boeing goes bionic to roll out more Dreamliners
GM,General Motors says in talks to invest $2.73 billion in Brazil till 2024
GS,Goldman Sachs says 1MDB scandal could hit pay for top executives
OXY,UAE's ADNOC awards Occidental Petroleum onshore exploration block
UNH,"Court fight sheds light on Amazon, Berkshire, JPMorgan health venture"
XOM,Exxon-led project resumes Russia's domestic gas supplies,Exxon Mobil profit tops estimates as production rebounds
