AA,Alcoa's Australian aluminium smelter hit by power cut amid heatwave
AAL,"American Airlines, mechanics union reach tentative $4.2 billion contract deal",American Airlines reaches tentative contract deal with mechanics union
AAPL,Apple supplier Japan Display gets $920 million bailout from Ichigo,"LG Display looks to a more positive 2020 on OLED demand, shares rise"
AMGN,Amgen 2020 outlook falls short of Street estimates; shares slump
AMZN,"US STOCKS-Wall Street falls on virus concerns, Amazon limits losses","US STOCKS SNAPSHOT-S&P 500 opens lower on virus concerns, Amazon supports Nasdaq","Amazon holiday sales jump as one-day shipping pays dividends, stock up 13%"
ATVI,REFILE-EA forecasts fourth-quarter adjusted revenue below estimates
BA,Boeing discloses U.S. SEC probe over 737 MAX,Honeywell says 737 MAX production halt to hurt 2020 sales,Honeywell says 737 MAX grounding to hurt sales growth in 2020,Senior warns of 20% aerospace revenue fall from 737 MAX grounding,"FTSE 100 dips, midcaps advance on Brexit day","Boeing supplier Senior warns of lower aerospace revenue, margins"
BKR,U.S. drillers cut oil rigs for first week in three: Baker Hughes
BMY,Bristol-Myers pulls Opdivo+Yervoy lung application in Europe,CORRECTED-UPDATE 1-Bristol-Myers Squibb pulls Opdivo+Yervoy lung application in Europe,CORRECTED-Bristol-Myers pulls Opdivo+Yervoy lung application in Europe
CAT,Caterpillar's earnings add to industrial gloom,Caterpillar revenue drops 8.4%; sees 2020 profit below expectations
CBS,NBCUniversal's George Cheeks to lead CBS Entertainment Group
CHK,Second oilfield worker dies from blast at Texas drill site :Chesapeake,Second oilfield worker dies from blast at Texas drill site -Chesapeake,Authorities probe fatal blast at Chesapeake Energy drill site in Texas
CME,British regulator's scrutiny to fall on futures order after mystery spike in sterling
CVX,"Exxon, Chevron results augur tough year ahead, shares drop","WRAPUP 2-Exxon, Chevron results augur tough year ahead, shares drop 3%","Exxon, Chevron results augur tough year ahead, shares drop 3%","Chevron swings to large loss on $10 billion in charges, shares sink",Chevron swings to quarterly loss on $10.4 bln impairment charge,Chevron asks staff to postpone all non-essential travel to China,Chevron asks staff to postpone 'non-essential' business travel to China - memo
DAL,"UPDATE 2-Delta, American suspend all U.S.-China flights",Delta says it will suspend all U.S.-China flights
DE,Deere temporarily closes facilities in China due to coronavirus,UPDATE 2-Deere temporarily closes facilities in China due to coronavirus,Deere temporarily closes its facilities in China because of coronavirus
DIS,Hulu CEO Randy Freer steps down
DOV,Dover port boss says clock is ticking on new UK customs system
EA,REFILE-EA forecasts fourth-quarter adjusted revenue below estimates
EQT,Exclusive: Gas producer EQT seeks to raise $1 billion from royalty deal - sources
FB,Facebook to remove coronavirus misinformation after WHO declares global emergency,Zuckerberg pledges Facebook users privacy upgrades after $550 million facial recognition settlement
GILD,Gilead working with China to test Ebola drug as new coronavirus treatment,Gilead working with China to test Ebola drug as new coronavirus treatment
GS,Goldman Sachs says virus outbreak to hit U.S. and China growth
HON,Honeywell says 737 MAX production halt to hurt 2020 sales,Honeywell says 737 MAX grounding to hurt sales growth in 2020
IBM,Breakingviews - Will IBM be the next Microsoft or Nokia?,IBM CEO Rometty to step down; cloud boss to succeed
JNJ,Bayer wins EU recommendation for prostate cancer drug
LUV,"Southwest disputes U.S. government audit on safety lapses, shares slide"
LYB,Lyondell Houston refinery ran at near full capacity in Q4 2019: CEO
MA,"Swiping their way higher: Visa, Mastercard could be the next $1 trillion companies","Swiping their way higher: Visa, Mastercard could be the next $1 trillion companies"
MO,"Altria takes another $4 billion hit on Juul investment, revises deal terms"
MS,Morgan Stanley overhauls leadership at FX options unit: Bloomberg
NFLX,Adam Sandler to make four new movies for Netflix,Netflix extiende contrato con Adam Sandler para cuatro películas
NKE,Nike prototype Vaporfly shoe banned but current version going to Olympics,Athletics-New rules outlaw some of Nike's record-breaking shoes
PSX,Refiner Phillips 66 misses profit estimates on higher shutdowns,Refiner Phillips 66 quarterly profit slumps 70%
V,"Swiping their way higher: Visa, Mastercard could be the next $1 trillion companies","Swiping their way higher: Visa, Mastercard could be the next $1 trillion companies"
XOM,"Exxon, Chevron results augur tough year ahead, shares drop","WRAPUP 2-Exxon, Chevron results augur tough year ahead, shares drop 3%","Exxon, Chevron results augur tough year ahead, shares drop 3%","Exxon quarterly profit falls 5.2% on weak refining, chemical margins",CORRECTED-UPDATE 1-Papua New Guinea scraps talks with Exxon on P'nyang gas project,"REFILE-Exxon quarterly profit falls 5.2% on weak refining, chemical margins"
