AMZN,"India court stalls Amazon, Flipkart antitrust probes: lawyers"
BA,"Timeline: Highlights of the 16-year Airbus, Boeing trade war",Boeing tells FAA it does not believe 737 MAX wiring should be moved: sources
BIIB,"Buffett's Berkshire buys Kroger and Biogen, reduces Wells Fargo and Goldman stakes"
FB,Facebook CEO says backs regulation of harmful online content,Facebook offers more data for research on impacts of social media
GE,U.S. weighs blocking GE engine sales for China's new airplane - sources
GS,"Buffett's Berkshire buys Kroger and Biogen, reduces Wells Fargo and Goldman stakes"
IBM,IBM withdraws from RSA conference over coronavirus fears
J,Stocks To Watch: All Eyes On Walmart
JPM,JPMorgan names new co-heads of ESG equity research for EMEA region
KHC,"U.S. judge calls out CFTC's 'egregious misconduct' in Kraft Heinz, Mondelez settlement"
MDLZ,"U.S. judge calls out CFTC's 'egregious misconduct' in Kraft Heinz, Mondelez settlement"
NVDA,"S&P 500, Nasdaq gain on Nvidia, White House stock incentive report"
