AAPL,BRIEF-Apple Says Does Not Expect To Meet Revenue Guidance Provided For March Quarter,Apple says will not meet revenue guidance for March quarter due to coronavirus outbreak
C,Citigroup mandated for Turkish gas distributor Enerya sale - sources
CB,"Retailers Ross Stores, TJX Companies, Walmart Among 14 Companies To Increase Dividends In The Second Half Of February"
FB,"EU industry chief tells Facebook to adapt to EU, not other way round"
GM,Timeline: General Motors streamlines its international operations,TIMELINE-General Motors streamlines its international operations,"General Motors to wind down Australia, New Zealand operations, sell Thailand plant"
HPE,Xerox courts HP shareholders as takeover battle heats up
RIG,Transocean Adds $366 Million In Backlog Since October,BRIEF-Transocean Ltd. Reports Q4 Adjusted Loss Per Share of $0.43 Excluding Items
UNH,BRIEF-UnitedHealth Group Says Board Authorizes Payment Of Quarterly Dividend
